{
  "$schema": "https://decantr.ai/schemas/pattern.v2.json",
  "id": "tech-pills",
  "version": "1.0.0",
  "decantr_compat": ">=1.0.0",
  "name": "Tech Pills",
  "description": "Row of technology or integration pill badges showing compatibility and supported platforms. Each pill is a rounded badge with the technology name, displayed in a centered flex-wrap row. Used for 'works with' sections to communicate broad technology compatibility. Supports standard uniform styling or individually colored brand pills.",
  "dependencies": {
    "patterns": {},
    "recipes": {},
    "styles": {},
    "requires_core": {
      "components": [
        "Badge"
      ],
      "charts": []
    }
  },
  "components": [
    "Badge"
  ],
  "contained": false,
  "default_preset": "standard",
  "presets": {
    "standard": {
      "description": "Centered row of pill badges with uniform styling. Each pill has a rounded shape (border-radius: 20px), medium padding, semi-bold text, and a subtle hover lift. All pills use a consistent muted background with light text. Wrapped in a flex container with center justification and 12px gap. Max-width constrained to ~700px.",
      "components": [
        "Badge"
      ],
      "layout": {
        "layout": "row",
        "atoms": "_flex _flexwrap _justify[center] _gap3 _mw[700px] _mx[auto]",
        "slots": {
          "pill-items": "Array of Badge pills, each with _rounded[20px] _py2 _px5 _fs[0.85rem] _fw600 _transition _hover:translateY[-2px]. Background: _bgwhite/10. Text: _fgwhite/80. Each pill contains a technology name (e.g., 'React', 'Next.js', 'Claude', 'Cursor')."
        }
      },
      "code": {
        "imports": "import { tags } from 'decantr/tags';\nimport { css } from 'decantr/css';\nimport { Badge } from 'decantr/components';",
        "example": "function TechPillsStandard() {\n  const { section, div, h3 } = tags;\n  const techs = ['React', 'Next.js', 'Vue', 'Svelte', 'Claude', 'Cursor', 'Copilot', 'Windsurf'];\n\n  return section({ class: css('_py20 _relative _z1') },\n    div({ class: css('_container') },\n      h3({ class: css('_heading3 _text[center] _fgmuted _mb6') }, 'Works With'),\n      div({ class: css('_flex _flexwrap _justify[center] _gap3 _mw[700px] _mx[auto]') },\n        techs.map(t =>\n          Badge({ class: css('_rounded[20px] _py2 _px5 _fs[0.85rem] _fw600 _bgwhite/10 _fgwhite/80 _transition _hover:translateY[-2px]') }, t)\n        )\n      )\n    )\n  );\n}"
      }
    },
    "colored": {
      "description": "Each pill gets a unique brand color from a rotating palette. Background is the accent color at ~15% opacity, text uses the full accent color. Colors rotate through coral, amber, cyan, green, yellow, purple, pink, orange. Same layout and sizing as standard, but with per-pill color variation for visual interest.",
      "components": [
        "Badge"
      ],
      "layout": {
        "layout": "row",
        "atoms": "_flex _flexwrap _justify[center] _gap3 _mw[700px] _mx[auto]",
        "slots": {
          "pill-items": "Array of Badge pills with individual colors. Each pill: _rounded[20px] _py2 _px5 _fs[0.85rem] _fw600 _transition _hover:translateY[-2px]. Background uses the pill's accent color at 15% opacity (e.g., rgba(245,136,130,0.15)). Text uses the full accent color (e.g., #F58882). Colors rotate: coral, amber, cyan, green, yellow, purple, pink, orange."
        }
      },
      "code": {
        "imports": "import { tags } from 'decantr/tags';\nimport { css } from 'decantr/css';\nimport { Badge } from 'decantr/components';",
        "example": "function TechPillsColored() {\n  const { section, div, h3 } = tags;\n  const items = [\n    { name: 'React', bg: 'rgba(245,136,130,0.15)', fg: '#F58882' },\n    { name: 'Next.js', bg: 'rgba(253,163,3,0.15)', fg: '#FDA303' },\n    { name: 'Vue', bg: 'rgba(10,243,235,0.15)', fg: '#0AF3EB' },\n    { name: 'Svelte', bg: 'rgba(0,224,171,0.15)', fg: '#00E0AB' },\n    { name: 'Claude', bg: 'rgba(252,208,33,0.15)', fg: '#FCD021' },\n    { name: 'Cursor', bg: 'rgba(101,0,198,0.15)', fg: '#A855F7' },\n    { name: 'Copilot', bg: 'rgba(254,68,116,0.15)', fg: '#FE4474' },\n    { name: 'Windsurf', bg: 'rgba(252,141,13,0.15)', fg: '#FC8D0D' },\n  ];\n\n  return section({ class: css('_py20 _relative _z1') },\n    div({ class: css('_container') },\n      h3({ class: css('_heading3 _text[center] _fgmuted _mb6') }, 'Works With'),\n      div({ class: css('_flex _flexwrap _justify[center] _gap3 _mw[700px] _mx[auto]') },\n        items.map(i =>\n          Badge({ class: css('_rounded[20px] _py2 _px5 _fs[0.85rem] _fw600 _transition _hover:translateY[-2px]'), style: `background:${i.bg};color:${i.fg}` }, i.name)\n        )\n      )\n    )\n  );\n}"
      }
    }
  },
  "default_layout": {
    "layout": "row",
    "atoms": "_flex _flexwrap _justify[center] _gap3 _mw[700px] _mx[auto]",
    "slots": {
      "pill-items": "Technology compatibility pill badges in a centered row"
    }
  },
  "code": {
    "imports": "import { tags } from 'decantr/tags';\nimport { css } from 'decantr/css';\nimport { Badge } from 'decantr/components';",
    "example": "function TechPills() {\n  const { section, div, h3 } = tags;\n\n  return section({ class: css('_py20 _relative _z1') },\n    div({ class: css('_container') },\n      h3({ class: css('_heading3 _text[center] _fgmuted _mb6') }, 'Works With'),\n      div({ class: css('_flex _flexwrap _justify[center] _gap3 _mw[700px] _mx[auto]') },\n        // Badge pills for each technology, works-with section display\n      )\n    )\n  );\n}"
  },
  "io": {
    "consumes": [],
    "produces": [],
    "actions": []
  }
}
