{
  "$schema": "https://decantr.ai/schemas/pattern.v2.json",
  "id": "storefront-hero",
  "version": "1.0.0",
  "decantr_compat": ">=1.0.0",
  "name": "Storefront Hero",
  "description": "Creator landing page banner with cover image, avatar, bio, social links, and subscribe CTA. The first impression for fans.",
  "dependencies": {
    "patterns": {},
    "recipes": {},
    "styles": {},
    "requires_core": {
      "components": [
        "Button",
        "Avatar",
        "Badge",
        "icon"
      ],
      "charts": []
    }
  },
  "components": [
    "Button",
    "Avatar",
    "Badge",
    "icon"
  ],
  "default_preset": "standard",
  "presets": {
    "standard": {
      "description": "Full hero with cover image and all details",
      "components": [
        "Button",
        "Avatar",
        "Badge",
        "icon"
      ],
      "layout": {
        "layout": "stack",
        "atoms": "_flex _col",
        "slots": {
          "cover": "Banner/cover image area",
          "avatar": "Creator profile photo",
          "name": "Creator display name with verification badge",
          "tagline": "Short bio/description",
          "social": "Social media links",
          "stats": "Subscriber count, post count",
          "cta": "Primary subscribe button"
        }
      },
      "code": {
        "imports": "import { tags } from 'decantr/tags';\nimport { css } from 'decantr/css';\nimport { Button, Avatar, Badge, icon } from 'decantr/components';",
        "example": "function StorefrontHero({ creator, onSubscribe }) {\n  const { div, h1, p, span, a, img } = tags;\n\n  const socials = creator.socials || [];\n  const socialIcons = { twitter: 'twitter', instagram: 'instagram', youtube: 'youtube', tiktok: 'music-2', website: 'globe' };\n\n  return div({ class: css('_flex _col') },\n    div({ class: css('_relative _h[240px] _md:h[320px] _overflow[hidden]') },\n      creator.coverImage\n        ? img({ src: creator.coverImage, class: css('_wfull _hfull _objcover') })\n        : div({ class: css('_wfull _hfull _bgGradient _from[#F97316] _to[#8B5CF6]') }),\n      div({ class: css('_absolute _inset0 _bg[linear-gradient(transparent_60%,rgba(0,0,0,0.5))]') })\n    ),\n    div({ class: css('_relative _px6 _md:px12 _pb8') },\n      div({ class: css('_flex _col _md:row _aic _md:aie _gap6 _-mt16') },\n        Avatar({\n          src: creator.avatar,\n          name: creator.name,\n          size: 'xl',\n          class: css('_w32 _h32 _ring4 _ringbg _shadow')\n        }),\n        div({ class: css('_flex1 _tc _md:tl') },\n          div({ class: css('_flex _aic _jcc _md:jcs _gap2 _mb2') },\n            h1({ class: css('_heading2') }, creator.name),\n            creator.verified ? Badge({ variant: 'default', class: css('_bgPrimary') },\n              icon('check', { size: '12' })\n            ) : null\n          ),\n          p({ class: css('_fgmuted _mb4 _maxw[600px]') }, creator.tagline),\n          div({ class: css('_flex _aic _jcc _md:jcs _gap4 _mb4 _flexwrap') },\n            div({ class: css('_flex _aic _gap1') },\n              icon('users', { size: '16', class: css('_fgmuted') }),\n              span({ class: css('_fontmedium') }, creator.subscriberCount?.toLocaleString() || 0),\n              span({ class: css('_fgmuted') }, ' subscribers')\n            ),\n            div({ class: css('_flex _aic _gap1') },\n              icon('file-text', { size: '16', class: css('_fgmuted') }),\n              span({ class: css('_fontmedium') }, creator.postCount || 0),\n              span({ class: css('_fgmuted') }, ' posts')\n            )\n          ),\n          socials.length > 0 ? div({ class: css('_flex _aic _jcc _md:jcs _gap3') },\n            ...socials.map(s =>\n              a({ href: s.url, target: '_blank', class: css('_w8 _h8 _r[50%] _bgmuted/10 _flex _center _trans _hover:bgmuted/20') },\n                icon(socialIcons[s.platform] || 'link', { size: '16', class: css('_fgmuted') })\n              )\n            )\n          ) : null\n        ),\n        div({ class: css('_flex _gap2') },\n          Button({ variant: 'outline', size: 'lg' },\n            icon('share-2', { size: '18' })\n          ),\n          Button({ variant: 'primary', size: 'lg', class: css('studio-glow'), onclick: onSubscribe },\n            'Subscribe'\n          )\n        )\n      )\n    )\n  );\n}"
      }
    },
    "minimal": {
      "description": "Compact header-style hero",
      "components": [
        "Button",
        "Avatar",
        "icon"
      ],
      "layout": {
        "layout": "inline",
        "atoms": "_flex _aic _gap4 _p4 _borderB",
        "slots": {
          "avatar": "Small avatar",
          "name": "Creator name",
          "cta": "Subscribe button"
        }
      },
      "code": {
        "imports": "import { tags } from 'decantr/tags';\nimport { css } from 'decantr/css';\nimport { Button, Avatar, icon } from 'decantr/components';",
        "example": "function MinimalStorefrontHero({ creator, onSubscribe }) {\n  const { div, span } = tags;\n\n  return div({ class: css('_flex _aic _gap4 _p4 _borderB') },\n    Avatar({ src: creator.avatar, name: creator.name, size: 'md' }),\n    div({ class: css('_flex1') },\n      span({ class: css('_fontmedium') }, creator.name),\n      div({ class: css('_textsm _fgmuted') }, creator.subscriberCount, ' subscribers')\n    ),\n    Button({ variant: 'primary', onclick: onSubscribe }, 'Subscribe')\n  );\n}"
      }
    },
    "video": {
      "description": "Video background hero",
      "components": [
        "Button",
        "Avatar",
        "Badge",
        "icon"
      ],
      "layout": {
        "layout": "stack",
        "atoms": "_flex _col _relative",
        "slots": {
          "video": "Background video",
          "overlay": "Content overlay",
          "avatar": "Creator avatar",
          "content": "Name, bio, CTA"
        }
      },
      "code": {
        "imports": "import { tags } from 'decantr/tags';\nimport { css } from 'decantr/css';\nimport { Button, Avatar, Badge, icon } from 'decantr/components';",
        "example": "function VideoStorefrontHero({ creator, onSubscribe }) {\n  const { div, h1, p, video } = tags;\n\n  return div({ class: css('_relative _h[400px] _overflow[hidden]') },\n    video({\n      src: creator.backgroundVideo,\n      autoplay: true,\n      loop: true,\n      muted: true,\n      class: css('_absolute _inset0 _wfull _hfull _objcover')\n    }),\n    div({ class: css('_absolute _inset0 _bg[rgba(0,0,0,0.5)]') }),\n    div({ class: css('_absolute _inset0 _flex _col _center _tc _p6') },\n      Avatar({ src: creator.avatar, name: creator.name, size: 'xl', class: css('_mb4 _ring4 _ring[white/20]') }),\n      h1({ class: css('_heading2 _text[white] _mb2') }, creator.name),\n      p({ class: css('_text[white/80] _mb6 _maxw[500px]') }, creator.tagline),\n      Button({ variant: 'primary', size: 'lg', onclick: onSubscribe }, 'Subscribe Now')\n    )\n  );\n}"
      }
    }
  },
  "default_layout": {
    "layout": "stack",
    "atoms": "_flex _col",
    "slots": {
      "cover": "Cover image",
      "avatar": "Creator avatar",
      "content": "Name, bio, stats",
      "cta": "Subscribe action"
    }
  },
  "code": {
    "imports": "import { tags } from 'decantr/tags';\nimport { css } from 'decantr/css';\nimport { Button, Avatar, Badge, icon } from 'decantr/components';",
    "example": "function StorefrontHero(props) {\n  return StandardStorefrontHero(props);\n}"
  },
  "io": {
    "produces": [
      "subscribe-click",
      "share-click"
    ],
    "consumes": [
      "creator-data"
    ]
  }
}
