{
  "$schema": "https://decantr.ai/schemas/pattern.v2.json",
  "id": "kpi-grid",
  "version": "1.0.0",
  "decantr_compat": ">=0.9.0",
  "name": "KPI Grid",
  "description": "A grid of key performance indicator cards showing metrics with labels, values, and trend indicators",
  "dependencies": {
    "patterns": {},
    "recipes": {},
    "styles": {},
    "requires_core": {
      "components": [
        "Card",
        "Badge",
        "icon"
      ],
      "charts": []
    }
  },
  "contained": false,
  "components": [
    "Card",
    "icon",
    "Badge"
  ],
  "default_preset": "dashboard",
  "presets": {
    "dashboard": {
      "description": "4-column grid of stat cards with icon, label, value, and change percentage",
      "components": [
        "Card",
        "icon",
        "Badge"
      ],
      "layout": {
        "layout": "grid",
        "atoms": "_grid _gc2 _lg:gc4 _gap4 _p4",
        "slots": {
          "kpi-card": "Repeated Card with icon, label, value, and trend Badge",
          "icon": "Abstract icon placeholder for each KPI category",
          "value": "Primary metric value with _heading2 styling",
          "trend": "Change percentage Badge with positive/negative variant"
        }
      },
      "code": {
        "imports": "import { tags } from 'decantr/tags';\nimport { css } from 'decantr/css';\nimport { Card, Badge, icon } from 'decantr/components';",
        "example": "function KpiGrid({ items }) {\n  const { div, span, p } = tags;\n\n  const kpis = items || [\n    { label: 'Total Revenue', value: '$45,231', change: '+20.1%', trend: 'up', ic: 'dollar-sign' },\n    { label: 'Subscriptions', value: '2,350', change: '+180', trend: 'up', ic: 'users' },\n    { label: 'Active Now', value: '573', change: '+19', trend: 'up', ic: 'activity' },\n    { label: 'Bounce Rate', value: '24.5%', change: '-4.3%', trend: 'down', ic: 'trending-down' },\n  ];\n\n  return div({ class: css('_grid _gc2 _lg:gc4 _gap4') },\n    ...kpis.map(kpi =>\n      Card({ class: css('_flex _col _gap2 _p4') },\n        div({ class: css('_flex _jcsb _aic') },\n          span({ class: css('_textsm _fgmuted') }, kpi.label),\n          icon(kpi.ic, { size: '1rem', class: css('_fgmuted') })\n        ),\n        p({ class: css('_heading2') }, kpi.value),\n        Badge({ variant: kpi.trend === 'up' ? 'default' : 'secondary' }, kpi.change)\n      )\n    )\n  );\n}"
      }
    },
    "compact": {
      "description": "Denser 2-row layout with smaller cards, no icons, just label + value + sparkline placeholder",
      "components": [
        "Card"
      ],
      "layout": {
        "layout": "grid",
        "atoms": "_grid _gc2 _lg:gc4 _gap2 _p2",
        "slots": {
          "kpi-card": "Compact Card with label, value, and sparkline area",
          "value": "Primary metric value with _heading4 styling",
          "sparkline": "Placeholder area for inline sparkline chart"
        }
      },
      "code": {
        "imports": "import { tags } from 'decantr/tags';\nimport { css } from 'decantr/css';\nimport { Card } from 'decantr/components';",
        "example": "function KpiGridCompact({ items }) {\n  const { div, span, p } = tags;\n\n  const kpis = items || [\n    { label: 'Revenue', value: '$45.2k' },\n    { label: 'Users', value: '2,350' },\n    { label: 'Active', value: '573' },\n    { label: 'Bounce', value: '24.5%' },\n  ];\n\n  return div({ class: css('_grid _gc2 _lg:gc4 _gap2') },\n    ...kpis.map(kpi =>\n      Card({ class: css('_flex _col _gap1 _p3') },\n        span({ class: css('_textxs _fgmuted') }, kpi.label),\n        p({ class: css('_heading4') }, kpi.value),\n        div({ class: css('_h6 _bgmuted/10 _r1') })\n      )\n    )\n  );\n}"
      }
    }
  },
  "default_layout": {
    "layout": "grid",
    "atoms": "_grid _gc2 _lg:gc4 _gap4 _p4",
    "slots": {
      "kpi-card": "Repeated Card with icon, label, value, and trend Badge",
      "icon": "Abstract icon placeholder for each KPI category",
      "value": "Primary metric value with _heading2 styling",
      "trend": "Change percentage Badge with positive/negative variant"
    }
  },
  "code": {
    "imports": "import { tags } from 'decantr/tags';\nimport { css } from 'decantr/css';\nimport { Card, Badge, icon } from 'decantr/components';",
    "example": "function KpiGrid({ items }) {\n  const { div, span, p } = tags;\n\n  const kpis = items || [\n    { label: 'Total Revenue', value: '$45,231', change: '+20.1%', trend: 'up', ic: 'dollar-sign' },\n    { label: 'Subscriptions', value: '2,350', change: '+180', trend: 'up', ic: 'users' },\n    { label: 'Active Now', value: '573', change: '+19', trend: 'up', ic: 'activity' },\n    { label: 'Bounce Rate', value: '24.5%', change: '-4.3%', trend: 'down', ic: 'trending-down' },\n  ];\n\n  return div({ class: css('_grid _gc2 _lg:gc4 _gap4') },\n    ...kpis.map(kpi =>\n      Card({ class: css('_flex _col _gap2 _p4') },\n        div({ class: css('_flex _jcsb _aic') },\n          span({ class: css('_textsm _fgmuted') }, kpi.label),\n          icon(kpi.ic, { size: '1rem', class: css('_fgmuted') })\n        ),\n        p({ class: css('_heading2') }, kpi.value),\n        Badge({ variant: kpi.trend === 'up' ? 'default' : 'secondary' }, kpi.change)\n      )\n    )\n  );\n}"
  },
  "io": {
    "produces": [
      "kpi-data"
    ],
    "consumes": [
      "date-range"
    ]
  }
}
