{
  "$schema": "https://decantr.ai/schemas/pattern.v2.json",
  "id": "detail-header",
  "version": "1.0.0",
  "decantr_compat": ">=0.9.0",
  "name": "Detail Header",
  "description": "Page header for detail views with title, metadata, status, and action buttons",
  "dependencies": {
    "patterns": {},
    "styles": {},
    "requires_core": {
      "components": [
        "Avatar",
        "Badge",
        "Button",
        "Breadcrumb",
        "Separator",
        "icon"
      ],
      "charts": []
    }
  },
  "components": [
    "Avatar",
    "Badge",
    "Button",
    "Breadcrumb"
  ],
  "contained": false,
  "default_preset": "standard",
  "presets": {
    "standard": {
      "description": "Title, subtitle/description, status badge, breadcrumb, and action buttons. Horizontal layout with bottom border.",
      "components": [
        "Badge",
        "Button",
        "Breadcrumb",
        "Separator",
        "icon"
      ],
      "layout": {
        "layout": "row",
        "atoms": "_flex _col _gap4 _pb4 _bbsolid _bcborder",
        "slots": {
          "breadcrumb": "Navigation breadcrumb trail with BreadcrumbItem links",
          "title-row": "Horizontal row with title on left and action buttons on right: _flex _row _jcsb _aic",
          "title": "Page heading with _heading2",
          "subtitle": "Description text with _bodysm _fgmuted",
          "status": "Badge showing current status (active, draft, archived)",
          "actions": "Action buttons group: edit, delete, share with _flex _gap2"
        }
      },
      "code": {
        "imports": "import { tags } from 'decantr/tags';\nimport { css } from 'decantr/css';\nimport { Badge, Button, Breadcrumb, icon } from 'decantr/components';",
        "example": "function DetailHeader({ data }) {\n  const { div, h1, p, nav, a } = tags;\n\n  return div({ class: css('_flex _col _gap4 _pb4 _bbsolid _bcborder') },\n    Breadcrumb({},\n      Breadcrumb.Item({}, a({ href: '/' }, 'Home')),\n      Breadcrumb.Item({}, a({ href: '/items' }, 'Items')),\n      Breadcrumb.Item({ current: true }, data?.title || 'Detail')\n    ),\n    div({ class: css('_flex _row _jcsb _aic') },\n      div({ class: css('_flex _col _gap1') },\n        div({ class: css('_flex _row _gap3 _aic') },\n          h1({ class: css('_heading2') }, data?.title || 'Item Title'),\n          Badge({ variant: 'default' }, data?.status || 'Active')\n        ),\n        p({ class: css('_bodysm _fgmuted') }, data?.description || 'Item description goes here')\n      ),\n      div({ class: css('_flex _gap2') },\n        Button({ variant: 'outline', size: 'sm' }, icon('share'), 'Share'),\n        Button({ variant: 'outline', size: 'sm' }, icon('edit'), 'Edit'),\n        Button({ variant: 'destructive', size: 'sm' }, icon('trash'), 'Delete')\n      )\n    )\n  );\n}"
      }
    },
    "profile": {
      "description": "Large avatar on the left, name/title/bio on the right, stats row, and action buttons (follow, message).",
      "components": [
        "Avatar",
        "Badge",
        "Button",
        "icon"
      ],
      "layout": {
        "layout": "row",
        "atoms": "_flex _row _gap6 _items[start]",
        "slots": {
          "avatar": "Large Avatar (96px) with image and fallback initials",
          "info": "Vertical column with name, title, bio: _flex _col _gap2 _flex1",
          "name": "Display name with _heading2",
          "title": "Role or title with _bodysm _fgmuted",
          "bio": "Short biography with _body _fgmuted",
          "stats": "Horizontal stats row (followers, posts, etc.): _flex _gap6",
          "actions": "Action buttons: follow (primary), message (outline)"
        }
      },
      "code": {
        "imports": "import { tags } from 'decantr/tags';\nimport { css } from 'decantr/css';\nimport { Avatar, Badge, Button, icon } from 'decantr/components';",
        "example": "function DetailHeaderProfile({ data }) {\n  const { div, h1, p, span } = tags;\n\n  const stats = [\n    { label: 'Followers', value: '1,234' },\n    { label: 'Following', value: '567' },\n    { label: 'Posts', value: '89' },\n  ];\n\n  return div({ class: css('_flex _row _gap6 _items[start]') },\n    Avatar({ size: 'xl', src: data?.avatar, fallback: data?.initials || 'U' }),\n    div({ class: css('_flex _col _gap2 _flex1') },\n      div({ class: css('_flex _row _gap3 _aic') },\n        h1({ class: css('_heading2') }, data?.name || 'User Name'),\n        Badge({ variant: 'secondary' }, data?.role || 'Member')\n      ),\n      p({ class: css('_bodysm _fgmuted') }, data?.title || 'Software Engineer'),\n      p({ class: css('_body _fgmuted') }, data?.bio || 'No bio provided.'),\n      div({ class: css('_flex _gap6 _mt2') },\n        ...stats.map(s =>\n          div({ class: css('_flex _col _aic') },\n            span({ class: css('_textlg _fontbold') }, s.value),\n            span({ class: css('_textxs _fgmuted') }, s.label)\n          )\n        )\n      ),\n      div({ class: css('_flex _gap2 _mt3') },\n        Button({ variant: 'primary', size: 'sm' }, icon('user-plus'), 'Follow'),\n        Button({ variant: 'outline', size: 'sm' }, icon('mail'), 'Message')\n      )\n    )\n  );\n}"
      }
    }
  },
  "default_layout": {
    "layout": "row",
    "atoms": "_flex _col _gap4 _pb4 _bbsolid _bcborder",
    "slots": {
      "breadcrumb": "Navigation breadcrumb trail",
      "title-row": "Title + actions horizontal row",
      "title": "Page heading",
      "subtitle": "Description text",
      "status": "Status badge",
      "actions": "Action buttons"
    }
  },
  "code": {
    "imports": "import { tags } from 'decantr/tags';\nimport { css } from 'decantr/css';\nimport { Badge, Button, Breadcrumb, icon } from 'decantr/components';",
    "example": "function DetailHeader({ data }) {\n  const { div, h1, p, nav, a } = tags;\n\n  return div({ class: css('_flex _col _gap4 _pb4 _bbsolid _bcborder') },\n    Breadcrumb({},\n      Breadcrumb.Item({}, a({ href: '/' }, 'Home')),\n      Breadcrumb.Item({}, a({ href: '/items' }, 'Items')),\n      Breadcrumb.Item({ current: true }, data?.title || 'Detail')\n    ),\n    div({ class: css('_flex _row _jcsb _aic') },\n      div({ class: css('_flex _col _gap1') },\n        div({ class: css('_flex _row _gap3 _aic') },\n          h1({ class: css('_heading2') }, data?.title || 'Item Title'),\n          Badge({ variant: 'default' }, data?.status || 'Active')\n        ),\n        p({ class: css('_bodysm _fgmuted') }, data?.description || 'Item description goes here')\n      ),\n      div({ class: css('_flex _gap2') },\n        Button({ variant: 'outline', size: 'sm' }, icon('share'), 'Share'),\n        Button({ variant: 'outline', size: 'sm' }, icon('edit'), 'Edit'),\n        Button({ variant: 'destructive', size: 'sm' }, icon('trash'), 'Delete')\n      )\n    )\n  );\n}"
  },
  "io": {
    "consumes": [
      "data"
    ],
    "produces": [
      "actions"
    ],
    "actions": [
      "edit",
      "delete",
      "share"
    ]
  }
}
