{
  "$schema": "https://decantr.ai/schemas/pattern.v2.json",
  "id": "tool-list",
  "version": "1.0.0",
  "decantr_compat": ">=1.0.0",
  "name": "Tool List",
  "description": "Dense two-column list of tools or features with monospace names and muted descriptions. CLI-style layout with colored dot bullets and a colored left border accent per item. Each item gets a unique color from a rotating palette. Hover highlights the row background. Pure text layout with no component dependencies.",
  "dependencies": {
    "patterns": {},
    "recipes": {},
    "styles": {},
    "requires_core": {
      "components": [],
      "charts": []
    }
  },
  "components": [],
  "contained": false,
  "default_preset": "standard",
  "presets": {
    "standard": {
      "description": "Two-column grid of tool items with no gap between rows. Each item has: a 4px colored left border accent, a colored dot bullet (6px circle), a monospace tool name in the item's accent color, and a muted description below. Items have subtle bottom borders and a semi-transparent background that brightens on hover. Colors rotate through coral, amber, cyan, green, yellow, orange, purple, pink, crimson. Layout: 2-column grid on desktop, single column on mobile.",
      "components": [],
      "layout": {
        "layout": "grid",
        "atoms": "_grid _gc2 _gap0 _mw[880px] _mx[auto]",
        "slots": {
          "tool-name": "Tool name displayed in monospace font with _mono _fs[0.82rem] _fw600 _mb1. Includes a colored dot bullet (6px circle, inline-block, flex-shrink-0) before the name. Both the dot and name text use the item's accent color from the rotation palette. Wrapped in a _flex _items[center] _gap2 container.",
          "tool-description": "Tool description with _fs[0.82rem] _fgmuted _lh[1.4]. Brief one-line description of the tool's purpose."
        }
      },
      "code": {
        "imports": "import { tags } from 'decantr/tags';\nimport { css } from 'decantr/css';",
        "example": "function ToolList() {\n  const { section, div, h2, p, span } = tags;\n  const colors = ['#F58882', '#FDA303', '#0AF3EB', '#00E0AB', '#FCD021', '#FC8D0D', '#6500C6', '#FE4474', '#D80F4A'];\n  const tools = [\n    { name: 'decantr_read_essence', desc: 'Read the current essence spec from the working directory' },\n    { name: 'decantr_validate', desc: 'Validate an essence file against the schema and guard rules' },\n  ];\n\n  return section({ class: css('_py30 _relative _z1') },\n    div({ class: css('_container') },\n      h2({ class: css('_heading2 _text[center] _mb4') }, 'MCP Tools'),\n      p({ class: css('_text[center] _fgmuted _mx[auto] _mb14') }, '10 tools available via MCP.'),\n      div({ class: css('_grid _gc2 _gap0 _mw[880px] _mx[auto]') },\n        tools.map((t, i) => {\n          const color = colors[i % colors.length];\n          return div({ class: css('_py4 _px5 _pl9 _borderbottom _borderbottom[rgba(255,255,255,0.06)] _transition _bgwhite/2 _hover:bgwhite/5 _relative'), style: `border-left:4px solid ${color}` },\n            div({ class: css('_flex _items[center] _gap2 _mono _fs[0.82rem] _fw600 _mb1'), style: `color:${color}` },\n              span({ class: css('_w[6px] _h[6px] _rounded[50%] _inline-block _shrink0'), style: `background:${color}` }),\n              t.name\n            ),\n            div({ class: css('_fs[0.82rem] _fgmuted _lh[1.4]') }, t.desc)\n          );\n        })\n      )\n    )\n  );\n}"
      }
    },
    "compact": {
      "description": "Single-column layout with denser spacing. Same colored dot bullets and monospace names, but items are stacked in a single column for narrower containers or longer lists. Reduced padding for a more compact feel.",
      "components": [],
      "layout": {
        "layout": "grid",
        "atoms": "_grid _gc1 _gap0 _mw[640px] _mx[auto]",
        "slots": {
          "tool-name": "Monospace tool name with colored dot bullet, _mono _fs[0.8rem] _fw600. Color from rotating palette.",
          "tool-description": "Muted description text with _fs[0.8rem] _fgmuted _lh[1.4]."
        }
      },
      "code": {
        "imports": "import { tags } from 'decantr/tags';\nimport { css } from 'decantr/css';",
        "example": "function ToolListCompact() {\n  const { section, div, h2, span } = tags;\n\n  return section({ class: css('_py30') },\n    div({ class: css('_container') },\n      h2({ class: css('_heading2 _text[center] _mb14') }, 'Tools'),\n      div({ class: css('_grid _gc1 _gap0 _mw[640px] _mx[auto]') },\n        div({ class: css('_py3 _px4 _pl8 _borderbottom _bgwhite/2 _hover:bgwhite/5 _relative'), style: 'border-left:4px solid #F58882' },\n          div({ class: css('_flex _items[center] _gap2 _mono _fs[0.8rem] _fw600'), style: 'color:#F58882' },\n            span({ class: css('_w[6px] _h[6px] _rounded[50%]'), style: 'background:#F58882' }),\n            'tool_name'\n          ),\n          div({ class: css('_fs[0.8rem] _fgmuted') }, 'Tool description.')\n        )\n      )\n    )\n  );\n}"
      }
    }
  },
  "default_layout": {
    "layout": "grid",
    "atoms": "_grid _gc2 _gap0 _mw[880px] _mx[auto]",
    "slots": {
      "tool-name": "Monospace name with colored dot bullet",
      "tool-description": "Muted description text"
    }
  },
  "code": {
    "imports": "import { tags } from 'decantr/tags';\nimport { css } from 'decantr/css';",
    "example": "function ToolList() {\n  const { section, div, h2, p } = tags;\n\n  return section({ class: css('_py30 _relative _z1') },\n    div({ class: css('_container') },\n      h2({ class: css('_heading2 _text[center] _mb14') }, 'Tools'),\n      div({ class: css('_grid _gc2 _gap0 _mw[880px] _mx[auto]') },\n        // Tool items with colored left borders, dot bullets, monospace names, hover highlight\n      )\n    )\n  );\n}"
  },
  "io": {
    "consumes": [],
    "produces": [],
    "actions": []
  }
}
